{
    "$schema": "http://json-schema.org/draft-07/schema",
    "name": "bse_element_basis_set",
    "version": "0.1",
    "url": "TODO",
    "description": "JSON for describing how a element-based basis set is composed",
    "type": "object",
    "additionalProperties": false,
    "required": [
        "molssi_bse_schema",
        "basis_set_name",
        "basis_set_description",
        "basis_set_elements"
    ],
    "properties":
    {
        "molssi_bse_schema": {
            "description": "Info about which schema the file follows",
            "type": "object",
            "additionalProperties": false,
            "required": [
                "schema_type",
                "schema_version"
            ],
            "properties": {
                "schema_type" : {
                    "description": "What type of BSE JSON file this is",
                    "type": "string",
                    "enum": [ "element" ]
                },
                "schema_version": {
                    "description": "Version of the BSE element basis set schema being used",
                    "type": "string"
                }
            }
        },
        "basis_set_name": {
            "description": "Common name for the basis set",
            "type": "string"
        },
        "basis_set_description": {
            "description": "Brief description of the basis set",
            "type": "string"
        },
        "basis_set_notes": {
            "description": "Any notes pertaining to this basis set",
            "type": "string"
        },
        "basis_set_elements": {
            "description": "Data for the elements of the basis set",
            "type": "object",
            "additionalProperties": false,
            "patternProperties":   {
                "^\\d+$" : {
                    "description": "Data for a single element in the basis set",
                    "type": "object",
                    "additionalProperties": false,
                    "required": [ "element_components" ],
                    "properties": {
                        "element_components": {
                            "description": "Component files for this element",
                            "type": "array",
                            "minItems": 1,
                            "uniqueItems": true,
                            "items": {
                                "type": "string"
                            }
                        }
                    }
                }
            }
        }
    }
}
