{
    "molssi_bse_schema": {
        "schema_type": "element",
        "schema_version": "0.1"
    },
    "basis_set_name": "def2-SV(P)-JKFIT",
    "basis_set_description": "Coulomb/Exchange fitting auxiliary basis for def2-SV(P)",
    "basis_set_notes": "The JKFit for La/def2-SV(P) is different than the 'universal' JKFit",
    "basis_set_elements": {
        "57": {
            "element_components": [
                "ahlrichs_fit/def2-SV(P)-JKFIT_weigend2008a.1.json"
            ]
        }
    }
}
