{
    "molssi_bse_schema": {
        "schema_type": "element",
        "schema_version": "0.1"
    },
    "basis_set_name": "def2-SV(P)",
    "basis_set_description": "def2-SV(P)",
    "basis_set_elements": {
        "56": {
            "element_components": [
                "ahlrichs/bse_v0/SV/def2-SV-base_weigend2005a.0.json",
                "ahlrichs/ECP/def2-ECP_kaupp1991a.1.json"
            ]
        }
    }
}