{
    "molssi_bse_schema": {
        "schema_type": "element",
        "schema_version": "0.1"
    },
    "basis_set_name": "6-31++G",
    "basis_set_description": "Pople 6-31++G basis set",
    "basis_set_elements": {
        "1": {
            "element_components": [
                "pople/bse_v0/6-31G-H-BSE_ditchfield1971a.0.json",
                "pople/bse_v0/6-31G-diffuse_clark1983a.0.json"
            ]
        },
        "3": {
            "element_components": [
                "pople/bse_v0/6-31G_dill1975a.0.json",
                "pople/bse_v0/6-31G-diffuse_clark1983a.0.json"
            ]
        },
        "4": {
            "element_components": [
                "pople/bse_v0/6-31G_binkley1977a.0.json",
                "pople/bse_v0/6-31G-diffuse_clark1983a.0.json"
            ]
        },
        "5": {
            "element_components": [
                "pople/bse_v0/6-31G_dill1975a.0.json",
                "pople/bse_v0/6-31G-diffuse_clark1983a.0.json"
            ]
        },
        "6": {
            "element_components": [
                "pople/bse_v0/6-31G_hehre1972a.0.json",
                "pople/bse_v0/6-31G-diffuse_clark1983a.0.json"
            ]
        },
        "7": {
            "element_components": [
                "pople/bse_v0/6-31G_hehre1972a.0.json",
                "pople/bse_v0/6-31G-diffuse_clark1983a.0.json"
            ]
        },
        "8": {
            "element_components": [
                "pople/bse_v0/6-31G_hehre1972a.0.json",
                "pople/bse_v0/6-31G-diffuse_clark1983a.0.json"
            ]
        },
        "9": {
            "element_components": [
                "pople/bse_v0/6-31G_hehre1972a.0.json",
                "pople/bse_v0/6-31G-diffuse_clark1983a.0.json"
            ]
        },
        "10": {
            "element_components": [
                "pople/bse_v0/6-31G_noref.0.json",
                "pople/bse_v0/6-31G-diffuse_gill1992a.0.json"
            ]
        },
        "11": {
            "element_components": [
                "pople/bse_v0/6-21G-core_gordon1982a.0.json",
                "pople/bse_v0/6-31G-valence_francl1982a.0.json",
                "pople/bse_v0/6-31G-diffuse_spitznagel1987a.0.json"
            ]
        },
        "12": {
            "element_components": [
                "pople/bse_v0/6-21G-core_gordon1982a.0.json",
                "pople/bse_v0/6-31G-valence_francl1982a.0.json",
                "pople/bse_v0/6-31G-diffuse_spitznagel1987a.0.json"
            ]
        },
        "13": {
            "element_components": [
                "pople/bse_v0/6-21G-core_gordon1982a.0.json",
                "pople/bse_v0/6-31G-valence_francl1982a.0.json",
                "pople/bse_v0/6-31G-diffuse_spitznagel1987a.0.json"
            ]
        },
        "14": {
            "element_components": [
                "pople/bse_v0/6-21G-core_gordon1982a.0.json",
                "pople/bse_v0/6-31G-valence_francl1982a.0.json",
                "pople/bse_v0/6-31G-diffuse_spitznagel1987a.0.json"
            ]
        },
        "15": {
            "element_components": [
                "pople/bse_v0/6-21G-core_gordon1982a.0.json",
                "pople/bse_v0/6-31G-valence_francl1982a.0.json",
                "pople/bse_v0/6-31G-diffuse_spitznagel1987a.0.json"
            ]
        },
        "16": {
            "element_components": [
                "pople/bse_v0/6-21G-core_gordon1982a.0.json",
                "pople/bse_v0/6-31G-valence_francl1982a.0.json",
                "pople/bse_v0/6-31G-diffuse_spitznagel1987a.0.json"
            ]
        },
        "17": {
            "element_components": [
                "pople/bse_v0/6-21G-core_gordon1982a.0.json",
                "pople/bse_v0/6-31G-valence_francl1982a.0.json",
                "pople/bse_v0/6-31G-diffuse_spitznagel1987a.0.json"
            ]
        },
        "18": {
            "element_components": [
                "pople/bse_v0/6-21G-core_gordon1982a.0.json",
                "pople/bse_v0/6-31G-valence_francl1982a.0.json",
                "pople/bse_v0/6-31G-diffuse_gill1992a.0.json"
            ]
        },
        "19": {
            "element_components": [
                "pople/bse_v0/6-31G_rassolov1998a.0.json",
                "pople/bse_v0/6-31G-diffuse_noref.0.json"
            ]
        },
        "20": {
            "element_components": [
                "pople/bse_v0/6-31G_rassolov1998a.0.json",
                "pople/bse_v0/6-31G-diffuse_noref.0.json"
            ]
        }
    }
}