{
    "molssi_bse_schema": {
        "schema_type": "element",
        "schema_version": "0.1"
    },
    "basis_set_name": "cc-pVTZ-RIFIT",
    "basis_set_description": "cc-pVTZ-RIFIT",
    "basis_set_elements": {
        "1": {
            "element_components": [
                "dunning_fit/bse_v0/cc-pVTZ-RIFIT_weigend2002a.0.json"
            ]
        },
        "2": {
            "element_components": [
                "dunning_fit/bse_v0/cc-pVTZ-RIFIT_weigend2002a.0.json"
            ]
        },
        "3": {
            "element_components": [
                "dunning_fit/bse_v0/cc-pVTZ-RIFIT_hattig2005a.0.json"
            ]
        },
        "4": {
            "element_components": [
                "dunning_fit/bse_v0/cc-pVTZ-RIFIT_hattig2005a.0.json"
            ]
        },
        "5": {
            "element_components": [
                "dunning_fit/bse_v0/cc-pVTZ-RIFIT_weigend2002a.0.json"
            ]
        },
        "6": {
            "element_components": [
                "dunning_fit/bse_v0/cc-pVTZ-RIFIT_weigend2002a.0.json"
            ]
        },
        "7": {
            "element_components": [
                "dunning_fit/bse_v0/cc-pVTZ-RIFIT_weigend2002a.0.json"
            ]
        },
        "8": {
            "element_components": [
                "dunning_fit/bse_v0/cc-pVTZ-RIFIT_weigend2002a.0.json"
            ]
        },
        "9": {
            "element_components": [
                "dunning_fit/bse_v0/cc-pVTZ-RIFIT_weigend2002a.0.json"
            ]
        },
        "10": {
            "element_components": [
                "dunning_fit/bse_v0/cc-pVTZ-RIFIT_weigend2002a.0.json"
            ]
        },
        "11": {
            "element_components": [
                "dunning_fit/bse_v0/cc-pVTZ-RIFIT_hattig2005a.0.json"
            ]
        },
        "12": {
            "element_components": [
                "dunning_fit/bse_v0/cc-pVTZ-RIFIT_hattig2005a.0.json"
            ]
        },
        "13": {
            "element_components": [
                "dunning_fit/bse_v0/cc-pVTZ-RIFIT_weigend2002a.0.json"
            ]
        },
        "14": {
            "element_components": [
                "dunning_fit/bse_v0/cc-pVTZ-RIFIT_weigend2002a.0.json"
            ]
        },
        "15": {
            "element_components": [
                "dunning_fit/bse_v0/cc-pVTZ-RIFIT_weigend2002a.0.json"
            ]
        },
        "16": {
            "element_components": [
                "dunning_fit/bse_v0/cc-pVTZ-RIFIT_weigend2002a.0.json"
            ]
        },
        "17": {
            "element_components": [
                "dunning_fit/bse_v0/cc-pVTZ-RIFIT_weigend2002a.0.json"
            ]
        },
        "18": {
            "element_components": [
                "dunning_fit/bse_v0/cc-pVTZ-RIFIT_weigend2002a.0.json"
            ]
        },
        "31": {
            "element_components": [
                "dunning_fit/bse_v0/cc-pVTZ-RIFIT_weigend2002a.0.json"
            ]
        },
        "32": {
            "element_components": [
                "dunning_fit/bse_v0/cc-pVTZ-RIFIT_weigend2002a.0.json"
            ]
        },
        "33": {
            "element_components": [
                "dunning_fit/bse_v0/cc-pVTZ-RIFIT_weigend2002a.0.json"
            ]
        },
        "34": {
            "element_components": [
                "dunning_fit/bse_v0/cc-pVTZ-RIFIT_weigend2002a.0.json"
            ]
        },
        "35": {
            "element_components": [
                "dunning_fit/bse_v0/cc-pVTZ-RIFIT_weigend2002a.0.json"
            ]
        },
        "36": {
            "element_components": [
                "dunning_fit/bse_v0/cc-pVTZ-RIFIT_weigend2002a.0.json"
            ]
        }
    }
}
