{
    "molssi_bse_schema": {
        "schema_type": "element",
        "schema_version": "0.1"
    },
    "basis_set_name": "cc-pVTZ-JKFIT",
    "basis_set_description": "JK Fitting basis for use with cc-pVTZ",
    "basis_set_elements": {
        "1": {
            "element_components": [
                "dunning_fit/cc-pVTZ-JKFIT_weigend2002b.1.json"
            ]
        },
        "5": {
            "element_components": [
                "dunning_fit/cc-pVTZ-JKFIT_weigend2002b.1.json"
            ]
        },
        "6": {
            "element_components": [
                "dunning_fit/cc-pVTZ-JKFIT_weigend2002b.1.json"
            ]
        },
        "7": {
            "element_components": [
                "dunning_fit/cc-pVTZ-JKFIT_weigend2002b.1.json"
            ]
        },
        "8": {
            "element_components": [
                "dunning_fit/cc-pVTZ-JKFIT_weigend2002b.1.json"
            ]
        },
        "9": {
            "element_components": [
                "dunning_fit/cc-pVTZ-JKFIT_weigend2002b.1.json"
            ]
        },
        "13": {
            "element_components": [
                "dunning_fit/cc-pVTZ-JKFIT_weigend2002b.1.json"
            ]
        },
        "14": {
            "element_components": [
                "dunning_fit/cc-pVTZ-JKFIT_weigend2002b.1.json"
            ]
        },
        "15": {
            "element_components": [
                "dunning_fit/cc-pVTZ-JKFIT_weigend2002b.1.json"
            ]
        },
        "16": {
            "element_components": [
                "dunning_fit/cc-pVTZ-JKFIT_weigend2002b.1.json"
            ]
        },
        "17": {
            "element_components": [
                "dunning_fit/cc-pVTZ-JKFIT_weigend2002b.1.json"
            ]
        },
        "31": {
            "element_components": [
                "dunning_fit/cc-pVTZ-JKFIT_weigend2002b.1.json"
            ]
        },
        "32": {
            "element_components": [
                "dunning_fit/cc-pVTZ-JKFIT_weigend2002b.1.json"
            ]
        },
        "33": {
            "element_components": [
                "dunning_fit/cc-pVTZ-JKFIT_weigend2002b.1.json"
            ]
        },
        "34": {
            "element_components": [
                "dunning_fit/cc-pVTZ-JKFIT_weigend2002b.1.json"
            ]
        },
        "35": {
            "element_components": [
                "dunning_fit/cc-pVTZ-JKFIT_weigend2002b.1.json"
            ]
        }
    }
}