{
    "molssi_bse_schema": {
        "schema_type": "element",
        "schema_version": "0.1"
    },
    "basis_set_name": "pcJ-3",
    "basis_set_description": "Contracted version of the pcJ-3 basis",
    "basis_set_elements": {
        "1": {
            "element_components": [
                "jensen/pcJ-3_jensen2010a.1.json"
            ]
        },
        "2": {
            "element_components": [
                "jensen/pcJ-3_jensen2010a.1.json"
            ]
        },
        "3": {
            "element_components": [
                "jensen/pcJ-3_jensen2010a.1.json"
            ]
        },
        "4": {
            "element_components": [
                "jensen/pcJ-3_jensen2010a.1.json"
            ]
        },
        "5": {
            "element_components": [
                "jensen/pcJ-3_jensen2010a.1.json"
            ]
        },
        "6": {
            "element_components": [
                "jensen/pcJ-3_jensen2010a.1.json"
            ]
        },
        "7": {
            "element_components": [
                "jensen/pcJ-3_jensen2010a.1.json"
            ]
        },
        "8": {
            "element_components": [
                "jensen/pcJ-3_jensen2010a.1.json"
            ]
        },
        "9": {
            "element_components": [
                "jensen/pcJ-3_jensen2010a.1.json"
            ]
        },
        "10": {
            "element_components": [
                "jensen/pcJ-3_jensen2010a.1.json"
            ]
        },
        "11": {
            "element_components": [
                "jensen/pcJ-3_jensen2010a.1.json"
            ]
        },
        "12": {
            "element_components": [
                "jensen/pcJ-3_jensen2010a.1.json"
            ]
        },
        "13": {
            "element_components": [
                "jensen/pcJ-3_jensen2010a.1.json"
            ]
        },
        "14": {
            "element_components": [
                "jensen/pcJ-3_jensen2010a.1.json"
            ]
        },
        "15": {
            "element_components": [
                "jensen/pcJ-3_jensen2010a.1.json"
            ]
        },
        "16": {
            "element_components": [
                "jensen/pcJ-3_jensen2010a.1.json"
            ]
        },
        "17": {
            "element_components": [
                "jensen/pcJ-3_jensen2010a.1.json"
            ]
        },
        "18": {
            "element_components": [
                "jensen/pcJ-3_jensen2010a.1.json"
            ]
        }
    }
}